{
  "schema_version": 1,
  "id": "BHV-005",
  "kind": "behavior",
  "status": "observed",
  "title": "Type and ownership visual grammar",
  "summary": "Type positions use compact caret, optional, expected, array, string, and smart-pointer forms while expression operators keep their ordinary meaning.",
  "details": [
    "Pointer declarator stars become carets only in type positions; multiplication and dereference stars remain stars.",
    "std::optional<T> becomes T?, std::expected<T, E> becomes T?E, and nested std::array<T, N> becomes [N]T.",
    "unique_ptr<T> and shared_ptr<T> are presented as T^; a custom deleter is retained as a comma-delimited tilde arm.",
    "const char* becomes CString and additional pointer levels remain carets; string, string_view, and configured zero-terminated string aliases share the string color.",
    "Integer and floating C spellings normalize to the configured short aliases such as u32, i32, f32, and f64.",
    "CUDA complex spellings follow DEC-005: cuFloatComplex and cuComplex become CUDA-colored cf32, and cuDoubleComplex becomes CUDA-colored cf64.",
    "std::move and std::forward retain their operation names but are ownership-transfer colored; cpy marks an intentionally heavy by-value copy and copy joins the mutation/ownership color family.",
    "Casts collapse to dollar aliases and pointer stars inside cast type arguments become carets.",
    "Unsupported auto&& variable declarations stay raw, while forwarding references in parameters and range-for bindings have dedicated spellings."
  ],
  "scope": ["cpp-frontend/types", "cuda-frontend/types", "ownership"],
  "tags": ["pointer-caret", "optional", "expected", "array", "CString", "smart-pointer", "move"],
  "provenance": [
    {
      "kind": "code",
      "reference": "lua/custom/dans_frontend_cpp/parse.lua::strip_type and render.lua type/chunk paths",
      "note": "Type normalization and semantic chunks are centralized here for overlay paths."
    },
    {
      "kind": "code",
      "reference": "lua/custom/dans_frontend_cpp/pointer.lua and aliases.lua",
      "note": "Raw-line declarators, CString cases, casts, and ownership aliases cover non-overlay positions."
    }
  ],
  "evidence": [
    {
      "kind": "test",
      "reference": "tests/frontend_spec.lua type, nested-template, pointer, cast, and ownership cases",
      "claim": "Nested and top-level type transformations are pinned."
    },
    {
      "kind": "test",
      "reference": "tests/cstring_raw_spec.lua and tests/overlay_string_types_spec.lua",
      "claim": "Raw and overlay string/CString paths agree and avoid literal corruption."
    }
  ],
  "relations": [
    { "type": "constrained_by", "target": "INV-002" },
    { "type": "relates_to", "target": "DEC-002" },
    { "type": "relates_to", "target": "DEC-005" },
    { "type": "relates_to", "target": "DEC-004" }
  ],
  "retrieval": {
    "aliases": ["type syntax", "optional question mark", "pointer caret", "CString", "smart pointer display"],
    "questions": [
      "Why does a pointer type use caret without changing multiplication?",
      "How are optional, expected, arrays, and smart pointers rendered?",
      "Which operations are ownership-transfer colored?"
    ]
  },
  "last_verified": {
    "date": "2026-07-11",
    "revision": "worktree after 85417c9",
    "method": "Type-normalization code and focused raw/overlay/nested-type assertions reviewed."
  }
}
